{
  "$schema": "https://json-schema.org/draft/2020-12/schema",
  "$id": "https://mlip-bench.example/schemas/hpc-site-profile.schema.json",
  "title": "bench-hpc SiteProfile v1",
  "description": "Trusted, immutable site policy identity. Credential bytes never appear here — connection secrets live outside Git and are resolved only by the trusted Harness through a credential provider keyed by credential_profile_id.",
  "type": "object",
  "required": [
    "schema_version",
    "site_id",
    "scheduler",
    "connection",
    "account",
    "queues",
    "runtime_policy"
  ],
  "additionalProperties": false,
  "properties": {
    "schema_version": { "const": 1 },
    "site_id": { "type": "string", "minLength": 1 },
    "scheduler": { "enum": ["slurm", "compshare", "process"] },
    "connection": {
      "type": "object",
      "required": ["credential_profile_id", "target_binding", "remote_user", "remote_root_policy"],
      "additionalProperties": false,
      "properties": {
        "credential_profile_id": {
          "type": "string",
          "minLength": 1,
          "description": "Key into the Harness-owned credential provider. Never a key itself."
        },
        "target_binding": {
          "type": "string",
          "minLength": 1,
          "description": "Sanitized connection target identity (bound into the digest)."
        },
        "remote_user": { "type": "string", "minLength": 1 },
        "remote_root_policy": {
          "type": "string",
          "minLength": 1,
          "description": "Remote root template policy; contains {run_id}, never credentials."
        }
      }
    },
    "account": { "type": "string", "minLength": 1 },
    "queues": {
      "type": "object",
      "minProperties": 1,
      "additionalProperties": false,
      "propertyNames": { "enum": ["cpu", "gpu"] },
      "patternProperties": {
        "^(cpu|gpu)$": {
          "type": "object",
          "required": ["partition", "qos", "max_cpus", "max_memory_gb", "max_walltime_minutes"],
          "additionalProperties": false,
          "properties": {
            "partition": { "type": "string", "minLength": 1 },
            "qos": { "type": "string", "minLength": 1 },
            "max_cpus": { "type": "integer", "minimum": 1 },
            "max_memory_gb": { "type": "integer", "minimum": 1 },
            "max_gpus": { "type": "integer", "minimum": 0 },
            "max_walltime_minutes": { "type": "integer", "minimum": 1 }
          }
        }
      }
    },
    "resource_mapping": {
      "type": "object",
      "description": "Maps abstract workload types (cpu, gpu) to concrete queue names. When absent, each workload type maps to the queue of the same name. CPU workloads may map to the gpu queue when the account lacks cpu partition access; the mapping note documents the constraint.",
      "additionalProperties": false,
      "patternProperties": {
        "^(cpu|gpu)$": {
          "type": "object",
          "required": ["queue"],
          "additionalProperties": false,
          "properties": {
            "queue": { "enum": ["cpu", "gpu"], "description": "Target queue name; must exist in queues." },
            "note": { "type": "string", "description": "Human-readable constraint documentation; included in digest." }
          }
        }
      }
    },
    "resource_classes": {
      "type": "object",
      "description": "Named resource tiers (config shorthand): a caller may request a class by name (e.g. \"gpu-small\") and the harness resolves concrete scheduler parameters from it, instead of spelling ceilings. A class names a backing queue and may constrain any ceiling below the queue's maximum; omitted ceilings inherit the queue. Bound into the profile digest like any other policy; the Candidate sees the class name and ceilings only, never a partition.",
      "additionalProperties": false,
      "propertyNames": { "pattern": "^[a-z][a-z0-9-]*$" },
      "patternProperties": {
        "^[a-z][a-z0-9-]*$": {
          "type": "object",
          "required": ["queue"],
          "additionalProperties": false,
          "properties": {
            "queue": { "enum": ["cpu", "gpu"], "description": "Backing queue name; must exist in queues." },
            "max_cpus": { "type": "integer", "minimum": 1 },
            "max_memory_gb": { "type": "integer", "minimum": 1 },
            "max_gpus": { "type": "integer", "minimum": 0 },
            "max_walltime_minutes": { "type": "integer", "minimum": 1 }
          }
        }
      }
    },
    "runtime_policy": {
      "type": "object",
      "required": ["requires_apptainer"],
      "additionalProperties": false,
      "properties": {
        "requires_apptainer": { "type": "boolean" },
        "runtime_store": { "type": "string", "minLength": 1 },
        "apptainer_bin": { "type": "string", "minLength": 1 },
        "runtime_lock_dir": { "type": "string", "minLength": 1 },
        "gres_template": { "type": "string", "minLength": 1 },
        "images": { "type": "object" },
        "provider": { "type": "string" },
        "default_gpu_type": { "type": "string" },
        "default_gpu_vram_gb": { "type": "integer" },
        "region": { "type": "string" },
        "zone": { "type": "string" },
        "budget_policy": { "type": "object" },
        "image_source": { "enum": ["platform", "custom", "community", "shared"] }
      }
    },
    "qualification_policy": {
      "type": "object",
      "additionalProperties": false,
      "properties": {
        "required_probe_classes": {
          "type": "array",
          "items": { "type": "string", "enum": ["cpu", "gpu"] },
          "uniqueItems": true
        },
        "minimum_gpu_count": { "type": "integer", "minimum": 0 },
        "timeout_seconds": { "type": "integer", "minimum": 1 }
      }
    }
  }
}
